{
  "graph_model_id": "graph:docs:component:browser.wait_for_timeout",
  "compilation_id": null,
  "graph_schema_version": "graph-v1",
  "nodes": [
    {
      "node_id": "node-browser-wait-for-timeout-1",
      "lowered_kind": "execution",
      "source_anchor_ref": "docs:browser.wait_for_timeout:1",
      "expansion_role": "action:wait_for_timeout",
      "display_name": "等待超时",
      "node_kind": "browser.wait_for_timeout",
      "position": {
        "x": 60,
        "y": 80
      },
      "ports": [
        {
          "port_id": "in",
          "direction": "input",
          "relation_layer": "control",
          "semantic_slot": "in.control"
        },
        {
          "port_id": "out",
          "direction": "output",
          "relation_layer": "control",
          "semantic_slot": "out.control"
        }
      ],
      "node_config": {
        "timeout": 0
      }
    }
  ],
  "edges": [],
  "viewport": {
    "x": 0,
    "y": 0,
    "zoom": 1
  },
  "root_metadata": {
    "graph_compatibility": {
      "graph_data_version": "0.9.0",
      "built_with_app_version": "0.9.1",
      "minimum_loader_app_version": "0.5.2",
      "last_upgraded_by_app_version": "0.9.1",
      "upgrade_history": []
    }
  },
  "graph_effective_diagnostic_anchor_refs": []
}
