{
  "graph_model_id": "graph:docs:component:excel.write_file",
  "compilation_id": null,
  "graph_schema_version": "graph-v1",
  "nodes": [
    {
      "node_id": "node-excel-write-file-1",
      "lowered_kind": "execution",
      "source_anchor_ref": "docs:excel.write_file:1",
      "expansion_role": "action:write_excel_file",
      "display_name": "写入 Excel 文件",
      "node_kind": "excel.write_file",
      "position": {
        "x": 60,
        "y": 80
      },
      "ports": [
        {
          "port_id": "in",
          "direction": "input",
          "relation_layer": "control",
          "semantic_slot": "in.control"
        },
        {
          "port_id": "out",
          "direction": "output",
          "relation_layer": "control",
          "semantic_slot": "out.control"
        }
      ],
      "node_config": {
        "path": "output/example.xlsx",
        "sheet_name": "Sheet1",
        "rows": []
      }
    }
  ],
  "edges": [],
  "viewport": {
    "x": 0,
    "y": 0,
    "zoom": 1
  },
  "root_metadata": {
    "graph_compatibility": {
      "graph_data_version": "0.6.2",
      "built_with_app_version": "0.8.1",
      "minimum_loader_app_version": "0.5.2",
      "last_upgraded_by_app_version": "0.8.1",
      "upgrade_history": []
    }
  },
  "graph_effective_diagnostic_anchor_refs": []
}
