{
  "graph_model_id": "graph:docs:component:network.websocket_connect",
  "compilation_id": null,
  "graph_schema_version": "graph-v1",
  "nodes": [
    {
      "node_id": "node-network-websocket-connect-1",
      "lowered_kind": "execution",
      "source_anchor_ref": "docs:network.websocket_connect:1",
      "expansion_role": "network:websocket_connect",
      "display_name": "网络 WebSocket 连接",
      "node_kind": "network.websocket_connect",
      "position": {
        "x": 60,
        "y": 80
      },
      "ports": [
        {
          "port_id": "in",
          "direction": "input",
          "relation_layer": "control",
          "semantic_slot": "in.control"
        },
        {
          "port_id": "out",
          "direction": "output",
          "relation_layer": "control",
          "semantic_slot": "out.control"
        },
        {
          "port_id": "failed",
          "direction": "output",
          "relation_layer": "control",
          "semantic_slot": "out.failed"
        },
        {
          "port_id": "in:context_strategy",
          "direction": "input",
          "relation_layer": "data",
          "semantic_slot": "in.context_strategy"
        },
        {
          "port_id": "in:switch_context_id",
          "direction": "input",
          "relation_layer": "data",
          "semantic_slot": "in.switch_context_id"
        },
        {
          "port_id": "in:action",
          "direction": "input",
          "relation_layer": "data",
          "semantic_slot": "in.action"
        },
        {
          "port_id": "in:connection_id",
          "direction": "input",
          "relation_layer": "data",
          "semantic_slot": "in.connection_id"
        },
        {
          "port_id": "in:url",
          "direction": "input",
          "relation_layer": "data",
          "semantic_slot": "in.url"
        },
        {
          "port_id": "in:message",
          "direction": "input",
          "relation_layer": "data",
          "semantic_slot": "in.message"
        },
        {
          "port_id": "in:headers",
          "direction": "input",
          "relation_layer": "data",
          "semantic_slot": "in.headers"
        },
        {
          "port_id": "in:query",
          "direction": "input",
          "relation_layer": "data",
          "semantic_slot": "in.query"
        },
        {
          "port_id": "in:auth",
          "direction": "input",
          "relation_layer": "data",
          "semantic_slot": "in.auth"
        },
        {
          "port_id": "in:tls",
          "direction": "input",
          "relation_layer": "data",
          "semantic_slot": "in.tls"
        },
        {
          "port_id": "in:proxy",
          "direction": "input",
          "relation_layer": "data",
          "semantic_slot": "in.proxy"
        },
        {
          "port_id": "in:timeout",
          "direction": "input",
          "relation_layer": "data",
          "semantic_slot": "in.timeout"
        },
        {
          "port_id": "out:connection_id",
          "direction": "output",
          "relation_layer": "data",
          "semantic_slot": "out.connection_id"
        },
        {
          "port_id": "out:message",
          "direction": "output",
          "relation_layer": "data",
          "semantic_slot": "out.message"
        }
      ],
      "node_config": {
        "context_strategy": "inherit",
        "action": "connect",
        "connection_id": "example",
        "url": "wss://example.com/socket",
        "message": null,
        "headers": {},
        "timeout_seconds": null
      }
    }
  ],
  "edges": [],
  "viewport": {
    "x": 0,
    "y": 0,
    "zoom": 1
  },
  "root_metadata": {
    "graph_compatibility": {
      "graph_data_version": "0.9.0",
      "built_with_app_version": "0.9.0",
      "minimum_loader_app_version": "0.5.2",
      "last_upgraded_by_app_version": "0.9.0",
      "upgrade_history": []
    }
  },
  "graph_effective_diagnostic_anchor_refs": []
}
