{
  "graph_model_id": "graph:docs:example:control-branch-and-loop",
  "compilation_id": null,
  "graph_schema_version": "graph-v1",
  "nodes": [
    {
      "node_id": "node-1",
      "lowered_kind": "control",
      "source_anchor_ref": "docs:example:control-branch-and-loop:1",
      "expansion_role": "flow:start",
      "display_name": "开始",
      "node_kind": "flow.start",
      "position": {
        "x": 60,
        "y": 70
      },
      "ports": [
        {
          "port_id": "out",
          "direction": "output",
          "relation_layer": "control",
          "semantic_slot": "out.control"
        },
        {
          "port_id": "out:variables",
          "direction": "output",
          "relation_layer": "data",
          "semantic_slot": "out.variables"
        }
      ],
      "node_config": {
        "initial_variables": {},
        "browser_config": {
          "headless": true,
          "slow_mo_ms": 0
        }
      }
    },
    {
      "node_id": "node-2",
      "lowered_kind": "execution",
      "source_anchor_ref": "docs:example:control-branch-and-loop:2",
      "expansion_role": "action:set_variable",
      "display_name": "写入变量",
      "node_kind": "data.set_variable",
      "position": {
        "x": 350,
        "y": 70
      },
      "ports": [
        {
          "port_id": "in",
          "direction": "input",
          "relation_layer": "control",
          "semantic_slot": "in.control"
        },
        {
          "port_id": "in:value",
          "direction": "input",
          "relation_layer": "data",
          "semantic_slot": "in.value"
        },
        {
          "port_id": "out",
          "direction": "output",
          "relation_layer": "control",
          "semantic_slot": "out.control"
        },
        {
          "port_id": "out:value",
          "direction": "output",
          "relation_layer": "data",
          "semantic_slot": "out.value"
        }
      ],
      "node_config": {
        "name": "counter",
        "value": 0
      }
    },
    {
      "node_id": "node-3",
      "lowered_kind": "control",
      "source_anchor_ref": "docs:example:control-branch-and-loop:3",
      "expansion_role": "control:if",
      "display_name": "条件分支",
      "node_kind": "control.if",
      "position": {
        "x": 640,
        "y": 70
      },
      "ports": [
        {
          "port_id": "in",
          "direction": "input",
          "relation_layer": "control",
          "semantic_slot": "in.control"
        },
        {
          "port_id": "repeat",
          "direction": "input",
          "relation_layer": "control",
          "semantic_slot": "in.repeat"
        },
        {
          "port_id": "condition",
          "direction": "input",
          "relation_layer": "data",
          "semantic_slot": "in.condition"
        },
        {
          "port_id": "true",
          "direction": "output",
          "relation_layer": "control",
          "semantic_slot": "out.true"
        },
        {
          "port_id": "false",
          "direction": "output",
          "relation_layer": "control",
          "semantic_slot": "out.false"
        }
      ],
      "node_config": {
        "expression": "counter < 3"
      }
    },
    {
      "node_id": "node-4",
      "lowered_kind": "execution",
      "source_anchor_ref": "docs:example:control-branch-and-loop:4",
      "expansion_role": "action:increment_variable",
      "display_name": "变量递增",
      "node_kind": "data.increment_variable",
      "position": {
        "x": 930,
        "y": 70
      },
      "ports": [
        {
          "port_id": "in",
          "direction": "input",
          "relation_layer": "control",
          "semantic_slot": "in.control"
        },
        {
          "port_id": "out",
          "direction": "output",
          "relation_layer": "control",
          "semantic_slot": "out.control"
        },
        {
          "port_id": "out:value",
          "direction": "output",
          "relation_layer": "data",
          "semantic_slot": "out.value"
        }
      ],
      "node_config": {
        "variable_name": "counter",
        "step": 1
      }
    },
    {
      "node_id": "node-5",
      "lowered_kind": "control",
      "source_anchor_ref": "docs:example:control-branch-and-loop:5",
      "expansion_role": "control:while",
      "display_name": "条件循环",
      "node_kind": "control.while",
      "position": {
        "x": 60,
        "y": 280
      },
      "ports": [
        {
          "port_id": "in",
          "direction": "input",
          "relation_layer": "control",
          "semantic_slot": "in.control"
        },
        {
          "port_id": "repeat",
          "direction": "input",
          "relation_layer": "control",
          "semantic_slot": "in.repeat"
        },
        {
          "port_id": "condition",
          "direction": "input",
          "relation_layer": "data",
          "semantic_slot": "in.condition"
        },
        {
          "port_id": "loop",
          "direction": "output",
          "relation_layer": "control",
          "semantic_slot": "out.loop"
        },
        {
          "port_id": "done",
          "direction": "output",
          "relation_layer": "control",
          "semantic_slot": "out.done"
        }
      ],
      "node_config": {
        "expression": "counter < 3"
      }
    },
    {
      "node_id": "node-6",
      "lowered_kind": "execution",
      "source_anchor_ref": "docs:example:control-branch-and-loop:6",
      "expansion_role": "action:get_variable",
      "display_name": "读取变量",
      "node_kind": "data.get_variable",
      "position": {
        "x": 350,
        "y": 280
      },
      "ports": [
        {
          "port_id": "in",
          "direction": "input",
          "relation_layer": "control",
          "semantic_slot": "in.control"
        },
        {
          "port_id": "out",
          "direction": "output",
          "relation_layer": "control",
          "semantic_slot": "out.control"
        },
        {
          "port_id": "out:value",
          "direction": "output",
          "relation_layer": "data",
          "semantic_slot": "out.value"
        }
      ],
      "node_config": {
        "name": "counter"
      }
    }
  ],
  "edges": [
    {
      "edge_id": "edge-1",
      "relation_layer": "control",
      "from_node_id": "node-1",
      "to_node_id": "node-2",
      "from_port_id": "out",
      "to_port_id": "in"
    },
    {
      "edge_id": "edge-2",
      "relation_layer": "control",
      "from_node_id": "node-2",
      "to_node_id": "node-3",
      "from_port_id": "out",
      "to_port_id": "in"
    },
    {
      "edge_id": "edge-3",
      "relation_layer": "control",
      "from_node_id": "node-3",
      "to_node_id": "node-5",
      "from_port_id": "true",
      "to_port_id": "in"
    },
    {
      "edge_id": "edge-4",
      "relation_layer": "control",
      "from_node_id": "node-3",
      "to_node_id": "node-6",
      "from_port_id": "false",
      "to_port_id": "in"
    },
    {
      "edge_id": "edge-5",
      "relation_layer": "control",
      "from_node_id": "node-5",
      "to_node_id": "node-4",
      "from_port_id": "loop",
      "to_port_id": "in"
    },
    {
      "edge_id": "edge-6",
      "relation_layer": "control",
      "from_node_id": "node-4",
      "to_node_id": "node-5",
      "from_port_id": "out",
      "to_port_id": "repeat"
    },
    {
      "edge_id": "edge-7",
      "relation_layer": "control",
      "from_node_id": "node-5",
      "to_node_id": "node-6",
      "from_port_id": "done",
      "to_port_id": "in"
    }
  ],
  "viewport": {
    "x": 0,
    "y": 0,
    "zoom": 1
  },
  "root_metadata": {
    "graph_compatibility": {
      "graph_data_version": "0.6.2",
      "built_with_app_version": "0.8.1",
      "minimum_loader_app_version": "0.5.2",
      "last_upgraded_by_app_version": "0.8.1",
      "upgrade_history": []
    }
  },
  "graph_effective_diagnostic_anchor_refs": []
}
