{
  "graph_model_id": "graph:docs:component:control.switch",
  "compilation_id": null,
  "graph_schema_version": "graph-v1",
  "nodes": [
    {
      "node_id": "node-control-switch-1",
      "lowered_kind": "control",
      "source_anchor_ref": "docs:control.switch:1",
      "expansion_role": "control:switch",
      "display_name": "多路分支",
      "node_kind": "control.switch",
      "position": {
        "x": 60,
        "y": 80
      },
      "ports": [
        {
          "port_id": "in",
          "direction": "input",
          "relation_layer": "control",
          "semantic_slot": "in.control"
        },
        {
          "port_id": "selector",
          "direction": "input",
          "relation_layer": "data",
          "semantic_slot": "in.selector"
        },
        {
          "port_id": "case:default",
          "direction": "output",
          "relation_layer": "control",
          "semantic_slot": "out.default"
        }
      ],
      "node_config": {
        "selector": "#example",
        "expression": "1 == 1"
      }
    }
  ],
  "edges": [],
  "viewport": {
    "x": 0,
    "y": 0,
    "zoom": 1
  },
  "root_metadata": {
    "graph_compatibility": {
      "graph_data_version": "0.9.0",
      "built_with_app_version": "0.9.1",
      "minimum_loader_app_version": "0.5.2",
      "last_upgraded_by_app_version": "0.9.1",
      "upgrade_history": []
    }
  },
  "graph_effective_diagnostic_anchor_refs": []
}
