{
  "graph_model_id": "graph:docs:component:excel.read_cell",
  "compilation_id": null,
  "graph_schema_version": "graph-v1",
  "nodes": [
    {
      "node_id": "node-excel-read-cell-1",
      "lowered_kind": "execution",
      "source_anchor_ref": "docs:excel.read_cell:1",
      "expansion_role": "action:read_excel_cell",
      "display_name": "读取 Excel 单元格",
      "node_kind": "excel.read_cell",
      "position": {
        "x": 60,
        "y": 80
      },
      "ports": [
        {
          "port_id": "in",
          "direction": "input",
          "relation_layer": "control",
          "semantic_slot": "in.control"
        },
        {
          "port_id": "out",
          "direction": "output",
          "relation_layer": "control",
          "semantic_slot": "out.control"
        },
        {
          "port_id": "out:value",
          "direction": "output",
          "relation_layer": "data",
          "semantic_slot": "out.value"
        }
      ],
      "node_config": {
        "path": "output/example.xlsx",
        "sheet_name": "Sheet1",
        "cell": "A1",
        "variable_name": "result"
      }
    }
  ],
  "edges": [],
  "viewport": {
    "x": 0,
    "y": 0,
    "zoom": 1
  },
  "root_metadata": {
    "graph_compatibility": {
      "graph_data_version": "0.9.0",
      "built_with_app_version": "0.9.0",
      "minimum_loader_app_version": "0.5.2",
      "last_upgraded_by_app_version": "0.9.0",
      "upgrade_history": []
    }
  },
  "graph_effective_diagnostic_anchor_refs": []
}
