{
  "graph_model_id": "graph:docs:group:browser-scripts-and-extraction",
  "compilation_id": null,
  "graph_schema_version": "graph-v1",
  "nodes": [
    {
      "node_id": "node-browser-extract-web-table-1",
      "lowered_kind": "execution",
      "source_anchor_ref": "docs:browser.extract_web_table:1",
      "expansion_role": "action:extract_web_table",
      "display_name": "提取网页表格",
      "node_kind": "browser.extract_web_table",
      "position": {
        "x": 60,
        "y": 80
      },
      "ports": [
        {
          "port_id": "in",
          "direction": "input",
          "relation_layer": "control",
          "semantic_slot": "in.control"
        },
        {
          "port_id": "in:selector",
          "direction": "input",
          "relation_layer": "data",
          "semantic_slot": "in.selector"
        },
        {
          "port_id": "out",
          "direction": "output",
          "relation_layer": "control",
          "semantic_slot": "out.control"
        },
        {
          "port_id": "out:rows",
          "direction": "output",
          "relation_layer": "data",
          "semantic_slot": "out.rows"
        }
      ],
      "node_config": {
        "selector": "#example",
        "variable_name": "result"
      }
    },
    {
      "node_id": "node-browser-extract-web-table-to-excel-2",
      "lowered_kind": "execution",
      "source_anchor_ref": "docs:browser.extract_web_table_to_excel:2",
      "expansion_role": "action:extract_web_table_to_excel",
      "display_name": "提取网页表格到 Excel",
      "node_kind": "browser.extract_web_table_to_excel",
      "position": {
        "x": 350,
        "y": 80
      },
      "ports": [
        {
          "port_id": "in",
          "direction": "input",
          "relation_layer": "control",
          "semantic_slot": "in.control"
        },
        {
          "port_id": "in:selector",
          "direction": "input",
          "relation_layer": "data",
          "semantic_slot": "in.selector"
        },
        {
          "port_id": "out",
          "direction": "output",
          "relation_layer": "control",
          "semantic_slot": "out.control"
        }
      ],
      "node_config": {
        "selector": "#example",
        "path": "output/example.xlsx",
        "sheet_name": "Sheet1"
      }
    },
    {
      "node_id": "node-browser-inject-js-3",
      "lowered_kind": "execution",
      "source_anchor_ref": "docs:browser.inject_js:3",
      "expansion_role": "action:inject_js",
      "display_name": "注入 JS",
      "node_kind": "browser.inject_js",
      "position": {
        "x": 640,
        "y": 80
      },
      "ports": [
        {
          "port_id": "in",
          "direction": "input",
          "relation_layer": "control",
          "semantic_slot": "in.control"
        },
        {
          "port_id": "in:script",
          "direction": "input",
          "relation_layer": "data",
          "semantic_slot": "in.script"
        },
        {
          "port_id": "out",
          "direction": "output",
          "relation_layer": "control",
          "semantic_slot": "out.control"
        }
      ],
      "node_config": {
        "script": "example"
      }
    },
    {
      "node_id": "node-browser-run-js-4",
      "lowered_kind": "execution",
      "source_anchor_ref": "docs:browser.run_js:4",
      "expansion_role": "action:run_js",
      "display_name": "运行 JS",
      "node_kind": "browser.run_js",
      "position": {
        "x": 60,
        "y": 270
      },
      "ports": [
        {
          "port_id": "in",
          "direction": "input",
          "relation_layer": "control",
          "semantic_slot": "in.control"
        },
        {
          "port_id": "in:script",
          "direction": "input",
          "relation_layer": "data",
          "semantic_slot": "in.script"
        },
        {
          "port_id": "out",
          "direction": "output",
          "relation_layer": "control",
          "semantic_slot": "out.control"
        },
        {
          "port_id": "out:value",
          "direction": "output",
          "relation_layer": "data",
          "semantic_slot": "out.value"
        }
      ],
      "node_config": {
        "script": "example",
        "variable_name": "result"
      }
    }
  ],
  "edges": [],
  "viewport": {
    "x": 0,
    "y": 0,
    "zoom": 1
  },
  "root_metadata": {
    "graph_compatibility": {
      "graph_data_version": "0.9.0",
      "built_with_app_version": "0.9.0",
      "minimum_loader_app_version": "0.5.2",
      "last_upgraded_by_app_version": "0.9.0",
      "upgrade_history": []
    }
  },
  "graph_effective_diagnostic_anchor_refs": []
}
