{
  "graph_model_id": "graph:docs:group:time",
  "compilation_id": null,
  "graph_schema_version": "graph-v1",
  "nodes": [
    {
      "node_id": "node-time-get-current-time-1",
      "lowered_kind": "execution",
      "source_anchor_ref": "docs:time.get_current_time:1",
      "expansion_role": "action:get_current_time",
      "display_name": "获取当前时间",
      "node_kind": "time.get_current_time",
      "position": {
        "x": 60,
        "y": 80
      },
      "ports": [
        {
          "port_id": "in",
          "direction": "input",
          "relation_layer": "control",
          "semantic_slot": "in.control"
        },
        {
          "port_id": "out",
          "direction": "output",
          "relation_layer": "control",
          "semantic_slot": "out.control"
        },
        {
          "port_id": "out:value",
          "direction": "output",
          "relation_layer": "data",
          "semantic_slot": "out.value"
        }
      ],
      "node_config": {
        "variable_name": "result",
        "format": "iso",
        "timezone": "utc"
      }
    }
  ],
  "edges": [],
  "viewport": {
    "x": 0,
    "y": 0,
    "zoom": 1
  },
  "root_metadata": {
    "graph_compatibility": {
      "graph_data_version": "0.9.0",
      "built_with_app_version": "0.9.1",
      "minimum_loader_app_version": "0.5.2",
      "last_upgraded_by_app_version": "0.9.1",
      "upgrade_history": []
    }
  },
  "graph_effective_diagnostic_anchor_refs": []
}
